SCHOOL NAME,SAT Tests Taken,SAT Section Average,SAT Critical Reading Avg. Score,SAT Math Avg. Score,SAT Writing Avg. Score
STUYVESANT HIGH SCHOOL,832,699,679,735,682
BRONX HIGH SCHOOL OF SCIENCE,731,657,632,688,649
STATEN ISLAND TECHNICAL HIGH SCHOOL,227,651,635,682,636
HIGH SCHOOL OF AMERICAN STUDIES AT LEHMAN COLLEGE,92,640,636,648,636
TOWNSEND HARRIS HIGH SCHOOL,278,637,621,651,638
QUEENS HIGH SCHOOL FOR THE SCIENCES AT YORK COLLEGE,121,623,612,660,596
BARD HIGH SCHOOL EARLY COLLEGE,130,619,624,604,628
"HIGH SCHOOL FOR MATHEMATICS, SCIENCE AND ENGINEERING AT CITY COLLEGE",101,616,605,654,588
BROOKLYN TECHNICAL HIGH SCHOOL,1277,611,587,659,587
ELEANOR ROOSEVELT HIGH SCHOOL,127,586,572,594,592
BEACON HIGH SCHOOL,261,582,577,575,592
"BROOKLYN LATIN SCHOOL, THE",72,580,586,584,570
FIORELLO H. LAGUARDIA HIGH SCHOOL OF MUSIC & ART AND PERFORMING ARTS,531,569,566,564,577
N.Y.C. LAB SCHOOL FOR COLLABORATIVE STUDIES,114,559,537,590,550
BARD HIGH SCHOOL EARLY COLLEGE II,155,555,545,568,550
BACCALAUREATE SCHOOL FOR GLOBAL EDUCATION,61,546,524,568,544
LEON M. GOLDSTEIN HIGH SCHOOL FOR THE SCIENCES,259,543,524,561,542
"NEW EXPLORATIONS INTO SCIENCE, TECHNOLOGY AND MATH HIGH SCHOOL",159,541,522,574,525
MILLENNIUM HIGH SCHOOL,144,538,528,553,533
BARUCH COLLEGE CAMPUS HIGH SCHOOL,104,526,496,563,518
SCHOOL OF THE FUTURE HIGH SCHOOL,66,522,517,533,515
URBAN ACADEMY LABORATORY HIGH SCHOOL,30,516,527,508,512
QUEENS GATEWAY TO HEALTH SCIENCES SECONDARY SCHOOL,99,513,513,523,502
SCHOLARS' ACADEMY,89,511,499,537,496
PROFESSIONAL PERFORMING ARTS HIGH SCHOOL,94,508,509,490,523
BENJAMIN N. CARDOZO HIGH SCHOOL,888,505,480,545,489
FRANK SINATRA SCHOOL OF THE ARTS HIGH SCHOOL,174,498,504,496,494
FRANCIS LEWIS HIGH SCHOOL,934,492,468,539,467
MIDWOOD HIGH SCHOOL,824,491,478,519,476
ACADEMY OF AMERICAN STUDIES,135,490,487,492,491
BAYSIDE HIGH SCHOOL,708,483,462,523,464
MANHATTAN / HUNTER SCIENCE HIGH SCHOOL,111,482,473,506,467
WORLD JOURNALISM PREPARATORY: A COLLEGE BOARD SCHOOL,63,481,471,489,481
NYC ISCHOOL,92,479,473,483,479
MEDGAR EVERS COLLEGE PREPARATORY SCHOOL,165,479,476,481,479
MANHATTAN CENTER FOR SCIENCE AND MATHEMATICS,375,477,461,514,455
EDWARD R. MURROW HIGH SCHOOL,727,477,468,496,467
THE MICHAEL J. PETRIDES SCHOOL,107,476,472,488,466
HIGH SCHOOL FOR DUAL LANGUAGE AND ASIAN STUDIES,78,475,412,581,431
INSTITUTE FOR COLLABORATIVE EDUCATION,54,475,492,465,467
HIGH SCHOOL FOR ENVIRONMENTAL STUDIES,263,473,465,493,461
N.Y.C. MUSEUM SCHOOL,103,473,468,492,459
TOTTENVILLE HIGH SCHOOL,807,473,462,486,470
TALENT UNLIMITED HIGH SCHOOL,81,472,469,472,475
HIGH SCHOOL M560 s CITY AS SCHOOL,56,472,498,440,477
FOREST HILLS HIGH SCHOOL,762,469,456,497,454
"QUEENS SCHOOL OF INQUIRY, THE",58,466,455,498,443
BRONX CENTER FOR SCIENCE AND MATHEMATICS,81,466,459,480,457
BENJAMIN BANNEKER ACADEMY,185,464,471,472,448
SUSAN E. WAGNER HIGH SCHOOL,535,463,455,474,459
HIGH SCHOOL OF ECONOMICS AND FINANCE,167,458,443,489,442
THOMAS A. EDISON CAREER AND TECHNICAL EDUCATION HIGH SCHOOL,422,458,452,478,442
FREDERICK DOUGLASS ACADEMY,214,458,458,474,442
MANHATTAN VILLAGE ACADEMY,95,458,441,473,458
AVIATION CAREER & TECHNICAL EDUCATION HIGH SCHOOL,396,455,445,496,423
"SCIENCE, TECHNOLOGY AND RESEARCH EARLY COLLEGE HIGH SCHOOL AT ERASMUS",69,454,457,462,441
"CITY POLYTECHNIC HIGH SCHOOL OF ENGINEERING, ARCHITECTURE, AND TECHNOLOGY",20,451,441,499,413
BROOKLYN COLLEGE ACADEMY,131,451,456,456,440
CSI HIGH SCHOOL FOR INTERNATIONAL STUDIES,137,451,452,451,450
JAMES MADISON HIGH SCHOOL,518,450,436,475,439
COLLEGIATE INSTITUTE FOR MATH AND SCIENCE,97,450,444,471,433
"HIGH SCHOOL FOR CONSTRUCTION TRADES, ENGINEERING AND ARCHITECTURE",194,449,429,491,425
RIVERDALE / KINGSBRIDGE ACADEMY (MIDDLE SCHOOL / HIGH SCHOOL 141),113,445,438,455,440
CONCORD HIGH SCHOOL,10,445,466,455,414
ROBERT F. KENNEDY COMMUNITY HIGH SCHOOL,99,444,431,458,441
"ROBERT F. WAGNER, JR. SECONDARY SCHOOL FOR ARTS AND TECHNOLOGY",80,444,443,447,440
YOUNG WOMEN'S LEADERSHIP SCHOOL,70,442,432,446,448
HIGH SCHOOL OF TELECOMMUNICATION ARTS AND TECHNOLOGY,238,441,425,474,424
GED PLUS s CITYWIDE,8,441,496,400,426
ALL CITY LEADERSHIP SECONDARY SCHOOL,39,439,428,465,422
"YOUNG WOMEN'S LEADERSHIP SCHOOL, QUEENS",68,439,439,445,432
ART AND DESIGN HIGH SCHOOL,270,439,444,441,430
BROOKLYN STUDIO SECONDARY SCHOOL,119,438,429,449,435
BEDFORD ACADEMY HIGH SCHOOL,89,438,438,443,431
A. PHILIP RANDOLPH CAMPUS HIGH SCHOOL,228,437,430,456,423
FORT HAMILTON HIGH SCHOOL,694,436,417,478,411
JAMAICA GATEWAY TO THE SCIENCES,25,436,430,452,425
HIGH SCHOOL FOR HEALTH PROFESSIONS AND HUMAN SERVICES,336,436,429,449,428
P.S. Q811,32,436,429,444,433
HARVEY MILK HIGH SCHOOL,9,435,458,416,429
CURTIS HIGH SCHOOL,375,434,437,435,429
PACE HIGH SCHOOL,85,431,423,438,432
"URBAN ASSEMBLY SCHOOL FOR APPLIED MATH AND SCIENCE, THE",80,430,411,464,415
PELHAM PREPARATORY ACADEMY,76,430,431,438,419
GEORGE WASHINGTON CARVER HIGH SCHOOL FOR THE SCIENCES,59,429,436,427,424
ACADEMY OF FINANCE AND ENTERPRISE,89,427,405,454,421
PORT RICHMOND HIGH SCHOOL,271,427,424,438,417
"QUEENS HIGH SCHOOL OF TEACHING, LIBERAL ARTS AND THE SCIENCES",175,427,425,434,420
NEW DORP HIGH SCHOOL,391,426,424,437,416
HIGH SCHOOL OF ARTS AND TECHNOLOGY,75,426,433,433,411
WILLIAM CULLEN BRYANT HIGH SCHOOL,395,425,414,449,412
HIGH SCHOOL FOR PUBLIC SERVICE: HEROES OF TOMORROW,79,425,418,441,414
NEW UTRECHT HIGH SCHOOL,456,424,402,471,399
EASTsWEST SCHOOL OF INTERNATIONAL STUDIES,59,424,416,463,392
QUEENS VOCATIONAL AND TECHNICAL HIGH SCHOOL,155,424,417,447,406
CITY COLLEGE ACADEMY OF THE ARTS,60,424,408,446,416
"CELIA CRUZ BRONX HIGH SCHOOL OF MUSIC, THE",52,424,423,420,427
SOUTH BROOKLYN COMMUNITY HIGH SCHOOL,8,424,430,416,425
"URBAN ASSEMBLY SCHOOL OF DESIGN AND CONSTRUCTION, THE",48,423,404,449,416
BRONX HIGH SCHOOL FOR THE VISUAL ARTS,48,423,419,433,416
QUEENS COLLEGIATE: A COLLEGE BOARD SCHOOL,68,422,420,445,400
ROBERT H. GODDARD HIGH SCHOOL OF COMMUNICATION ARTS AND TECHNOLOGY,93,422,423,426,416
JOHN DEWEY HIGH SCHOOL,448,421,404,468,390
MARBLE HILL HIGH SCHOOL FOR INTERNATIONAL STUDIES,99,421,414,435,414
BROOKLYN HIGH SCHOOL OF THE ARTS,141,420,426,421,411
ACADEMY FOR CAREERS IN TELEVISION AND FILM,98,419,410,440,405
HOSTOSsLINCOLN ACADEMY OF SCIENCE,66,419,420,426,411
DEWITT CLINTON HIGH SCHOOL,443,419,419,426,410
THE HIGH SCHOOL OF FASHION INDUSTRIES,335,419,423,423,411
HUMANITIES PREPARATORY ACADEMY,36,419,426,403,426
CHANNEL VIEW SCHOOL FOR RESEARCH,74,418,432,419,401
REPERTORY COMPANY HIGH SCHOOL FOR THEATRE ARTS,42,418,429,404,420
BRONX LATIN,36,417,408,432,411
CLARA BARTON HIGH SCHOOL,259,417,425,413,413
CASCADES HIGH SCHOOL,18,416,417,418,411
FRANKLIN DELANO ROOSEVELT HIGH SCHOOL,385,415,383,486,375
JOHN BOWNE HIGH SCHOOL,558,415,397,451,395
MURRY BERGTRAUM HIGH SCHOOL FOR BUSINESS CAREERS,264,414,407,440,393
HERBERT H. LEHMAN HIGH SCHOOL,415,414,412,436,393
EAST NEW YORK FAMILY ACADEMY,54,414,416,432,394
CIVIC LEADERSHIP ACADEMY,69,414,404,429,407
INFORMATION TECHNOLOGY HIGH SCHOOL,148,413,407,434,398
RACHEL CARSON HIGH SCHOOL FOR COASTAL STUDIES,54,413,402,427,408
JACQUELINE KENNEDY ONASSIS HIGH SCHOOL,131,413,414,425,400
LIFE SCIENCES SECONDARY SCHOOL,61,412,409,424,403
RALPH R. MCKEE CAREER AND TECHNICAL EDUCATION HIGH SCHOOL,94,412,416,422,397
LEADERSHIP AND PUBLIC SERVICE HIGH SCHOOL,84,411,416,426,391
ACADEMY OF BUSINESS AND COMMUNITY DEVELOPMENT,9,411,439,374,418
MANHATTAN INTERNATIONAL HIGH SCHOOL,49,409,376,460,391
ABRAHAM LINCOLN HIGH SCHOOL,475,409,396,437,393
HIGH SCHOOL FOR HEALTH CAREERS AND SCIENCES,24,408,400,422,402
"BRONX SCHOOL FOR LAW, GOVERNMENT AND JUSTICE",80,408,404,418,402
BELMONT PREPARATORY HIGH SCHOOL,51,408,404,418,400
"MATHEMATICS, SCIENCE RESEARCH AND TECHNOLOGY MAGNET HIGH SCHOOL",78,407,400,426,394
CENTRAL PARK EAST HIGH SCHOOL,73,407,405,421,395
BRONX HIGH SCHOOL FOR MEDICAL SCIENCE,64,407,400,419,402
HIGH SCHOOL OF APPLIED COMMUNICATION,39,407,406,413,400
FLUSHING HIGH SCHOOL,347,406,393,441,382
LONG ISLAND CITY HIGH SCHOOL,392,406,403,420,395
"THE HIGH SCHOOL FOR ENTERPRISE, BUSINESS AND TECHNOLOGY",142,405,398,421,396
THE URBAN ASSEMBLY NEW YORK HARBOR SCHOOL,77,404,405,423,384
GROVER CLEVELAND HIGH SCHOOL,241,404,395,420,396
"SCIENCE SKILLS CENTER HIGH SCHOOL FOR SCIENCE, TECHNOLOGY AND THE CREATIVE ARTS",92,404,399,417,395
SCHOOL FOR INTERNATIONAL STUDIES,64,404,405,415,392
MOTT HALL HIGH SCHOOL,54,404,413,399,398
MARTA VALLE HIGH SCHOOL,44,403,390,433,384
CHELSEA CAREER AND TECHNICAL EDUCATION HIGH SCHOOL,83,403,399,418,390
LOWER EAST SIDE PREPARATORY HIGH SCHOOL,112,402,332,557,316
MANHATTAN COMPREHENSIVE NIGHT AND DAY HIGH SCHOOL,121,402,345,517,343
THE URBAN ASSEMBLY SCHOOL FOR LAW AND JUSTICE,105,402,400,417,389
SCHOOL FOR LEGAL STUDIES,134,402,413,396,395
NEWTOWN HIGH SCHOOL,320,401,383,440,380
SECONDARY SCHOOL FOR LAW,59,401,398,411,394
THURGOOD MARSHALL ACADEMY FOR LEARNING AND SOCIAL CHANGE,66,401,396,402,404
EXCELSIOR PREPARATORY HIGH SCHOOL,49,401,402,398,402
UNIVERSITY HEIGHTS SECONDARY SCHOOL,79,401,403,394,404
BRONX ACADEMY OF LETTERS,51,401,413,381,407
VANGUARD HIGH SCHOOL,72,400,395,416,388
INNOVATION DIPLOMA PLUS,12,400,416,403,381
LOWER MANHATTAN ARTS ACADEMY,40,400,403,392,405
GATEWAY SCHOOL FOR ENVIRONMENTAL RESEARCH AND TECHNOLOGY,41,400,416,390,394
TEACHERS PREPARATORY HIGH SCHOOL,69,399,392,416,388
GAYNOR MCCOWN EXPEDITIONARY LEARNING SCHOOL,61,399,398,412,385
HIGH SCHOOL FOR LAW ENFORCEMENT AND PUBLIC SAFETY,74,399,406,406,384
"HIGH SCHOOL FOR LAW, ADVOCACY AND COMMUNITY JUSTICE",66,399,396,398,402
RICHARD R. GREEN HIGH SCHOOL OF TEACHING,84,399,408,384,403
BROOKLYN ACADEMY HIGH SCHOOL,8,399,435,383,379
TRANSIT TECH CAREER AND TECHNICAL EDUCATION HIGH SCHOOL,182,398,395,418,380
HILLCREST HIGH SCHOOL,462,398,395,413,386
JOHN ADAMS HIGH SCHOOL,403,398,391,409,392
FOOD AND FINANCE HIGH SCHOOL,62,398,409,393,392
FREEDOM ACADEMY HIGH SCHOOL,29,398,400,390,403
MANHATTAN THEATRE LAB HIGH SCHOOL,27,398,406,379,408
EAST BROOKLYN COMMUNITY HIGH SCHOOL,12,397,410,403,378
THEATRE ARTS PRODUCTION COMPANY SCHOOL,59,397,405,391,394
GEORGE WESTINGHOUSE CAREER AND TECHNICAL EDUCATION HIGH SCHOOL,85,397,406,391,392
GREEN SCHOOL: AN ACADEMY FOR ENVIRONMENTAL CAREERS,41,397,407,386,396
EMMA LAZARUS HIGH SCHOOL,79,396,319,512,357
WILLIAMSBURG PREPARATORY SCHOOL,113,396,397,410,380
FOREIGN LANGUAGE ACADEMY OF GLOBAL STUDIES,64,396,399,396,391
"JAMES BALDWIN SCHOOL, THE: A SCHOOL FOR EXPEDITIONARY LEARNING",69,396,408,390,390
HERBERT H. LEHMAN YABC,6,396,402,373,413
SAMUEL GOMPERS CAREER AND TECHNICAL EDUCATION HIGH SCHOOL,47,395,398,416,370
WILLIAM E. GRADY CAREER AND TECHNICAL EDUCATION HIGH SCHOOL,95,395,394,414,376
BROOKLYN COLLEGIATE: A COLLEGE BOARD SCHOOL,60,395,389,409,387
COBBLE HILL SCHOOL OF AMERICAN STUDIES,77,395,398,402,385
HIGH SCHOOL FOR INNOVATION IN ADVERTISING AND MEDIA,37,395,404,393,386
BEDFORD STUYVESANT PREPARATORY HIGH SCHOOL,13,395,398,391,394
URBAN ASSEMBLY SCHOOL FOR CAREERS IN SPORTS,44,394,387,411,383
INsTECH ACADEMY (M.S. / HIGH SCHOOL 368),111,394,390,408,383
KNOWLEDGE AND POWER PREPARATORY ACADEMY INTERNATIONAL HIGH SCHOOL (KAPPA),61,394,392,401,387
47 THE AMERICAN SIGN LANGUAGE AND ENGLISH SECONDARY SCHOOL,16,394,395,400,387
BRONX SCHOOL OF LAW AND FINANCE,54,394,402,395,385
BRONX REGIONAL HIGH SCHOOL,16,394,398,385,398
NORTH QUEENS COMMUNITY HIGH SCHOOL,7,393,379,421,377
QUEENS SATELLITE HIGH SCHOOL FOR OPPORTUNITY,6,393,403,408,367
BROOKLYN SECONDARY SCHOOL FOR COLLABORATIVE STUDIES,76,393,393,399,387
MIDDLE COLLEGE HIGH SCHOOL AT LAGUARDIA COMMUNITY COLLEGE,58,393,399,393,385
PARK SLOPE COLLEGIATE,72,392,379,416,380
HIGH SCHOOL FOR ARTS AND BUSINESS,138,392,391,403,380
FORSYTH SATELLITE ACADEMY,7,392,414,401,359
WASHINGTON HEIGHTS EXPEDITIONARY LEARNING SCHOOL,70,392,380,395,399
GRAMERCY ARTS HIGH SCHOOL,60,392,391,391,394
THE HIGH SCHOOL FOR GLOBAL CITIZENSHIP,46,392,403,385,388
UNIVERSITY NEIGHBORHOOD HIGH SCHOOL,91,391,383,423,366
MARTIN VAN BUREN HIGH SCHOOL,334,391,391,397,384
PATHWAYS COLLEGE PREPARATORY SCHOOL: A COLLEGE BOARD SCHOOL,46,391,401,397,375
WOMEN'S ACADEMY OF EXCELLENCE,44,391,407,386,378
HIGH SCHOOL X560 s BRONX ACADEMY HIGH SCHOOL,9,391,404,368,399
LANDMARK HIGH SCHOOL,62,390,390,399,381
NEW DESIGN HIGH SCHOOL,73,390,391,395,382
CULTURAL ACADEMY FOR THE ARTS AND SCIENCES,33,390,393,395,381
EXIMIUS COLLEGE PREPARATORY ACADEMY: A COLLEGE BOARD SCHOOL,50,390,393,394,382
ASTOR COLLEGIATE ACADEMY,60,390,387,391,391
SECONDARY SCHOOL FOR JOURNALISM,58,390,397,391,381
QUEENS ACADEMY HIGH SCHOOL,17,390,398,382,388
BRONX LEADERSHIP ACADEMY HIGH SCHOOL,114,389,384,394,388
MILLENNIUM ART ACADEMY,67,388,387,402,375
HIGH SCHOOL OF SPORTS MANAGEMENT,39,388,388,398,378
BRONX AEROSPACE HIGH SCHOOL,46,388,388,393,382
HIGH SCHOOL FOR MEDICAL PROFESSIONS,75,387,386,380,393
LIBERTY HIGH SCHOOL ACADEMY FOR NEWCOMERS,26,386,368,436,352
WEST BRONX ACADEMY FOR THE FUTURE,26,386,382,406,370
"QUEENS HIGH SCHOOL FOR INFORMATION, RESEARCH, AND TECHNOLOGY",44,386,391,401,364
"THE SCHOOL FOR CLASSICS: AN ACADEMY OF THINKERS, WRITERS AND PERFORMERS",38,386,383,400,374
ALFRED E. SMITH CAREER AND TECHNICAL EDUCATION HIGH SCHOOL,76,386,394,400,364
"THE MARIE CURIE SCHOOL FOR MEDICINE, NURSING, AND HEALTH PROFESSIONS",79,386,382,393,382
RENAISSANCE HIGH SCHOOL FOR MUSICAL THEATER & TECHNOLOGY,52,386,384,385,389
ESSEX STREET ACADEMY,53,386,394,384,378
EBC HIGH SCHOOL FOR PUBLIC SERVICE–BUSHWICK,88,385,384,409,361
SCHOOL FOR DEMOCRACY AND LEADERSHIP,38,385,377,404,372
RICHMOND HILL HIGH SCHOOL,404,385,382,404,368
PEACE AND DIVERSITY ACADEMY,34,385,390,401,364
HIGH SCHOOL OF GRAPHIC COMMUNICATION ARTS,191,385,395,382,376
LIBERATION DIPLOMA PLUS,10,385,411,369,373
"BUSINESS, COMPUTER APPLICATIONS & ENTREPRENEURSHIP HIGH SCHOOL",49,384,379,414,359
BRONX ENGINEERING AND TECHNOLOGY ACADEMY,86,384,373,412,365
HARRY S TRUMAN HIGH SCHOOL,189,384,386,397,368
BROOKLYN SCHOOL FOR MUSIC & THEATRE,48,384,385,393,373
HUMANITIES & ARTS MAGNET HIGH SCHOOL,62,384,393,381,377
YOUNG ADULT BOROUGH CENTER AT STATEN IS TECH HS,10,384,405,375,370
EAST SIDE COMMUNITY SCHOOL,70,383,377,402,370
"URBAN ASSEMBLY ACADEMY OF GOVERNMENT AND LAW, THE",50,383,375,388,385
PERFORMING ARTS AND TECHNOLOGY HIGH SCHOOL,61,383,380,386,383
MORRIS ACADEMY FOR COLLABORATIVE STUDIES,38,383,386,386,376
BRONX HIGH SCHOOL FOR WRITING AND COMMUNICATION ARTS,46,383,400,357,390
SHEEPSHEAD BAY HIGH SCHOOL,236,382,383,392,370
INTERNATIONAL ARTS BUSINESS SCHOOL,54,382,386,391,369
"URBAN ASSEMBLY SCHOOL FOR MEDIA STUDIES, THE",41,382,384,390,370
FREDERICK DOUGLASS ACADEMY VI HIGH SCHOOL,87,382,387,385,373
BROOKLYN GENERATION SCHOOL,29,382,374,377,394
ACADEMY FOR SCHOLARSHIP AND ENTREPRENEURSHIP: A COLLEGE BOARD SCHOOL,56,381,386,394,361
BROOKLYN ACADEMY OF SCIENCE AND THE ENVIRONMENT,63,381,388,382,373
VICTORY COLLEGIATE HIGH SCHOOL,63,381,387,377,379
MONROE ACADEMY FOR BUSINESS/LAW,31,380,375,387,376
"LAW, GOVERNMENT AND COMMUNITY SERVICE HIGH SCHOOL",52,380,385,377,377
ACADEMY FOR COLLEGE PREPARATION AND CAREER EXPLORATION: A COLLEGE BOARD SCHOOL,59,380,396,374,369
OLYMPUS ACADEMY,7,380,400,370,370
DREAMYARD PREPARATORY SCHOOL,51,380,382,365,391
BRONX LAB SCHOOL,81,379,377,391,367
URBAN ACTION ACADEMY,40,379,376,385,374
BRONX ACADEMY OF HEALTH CAREERS,69,379,387,365,383
SCHOOL FOR COMMUNITY RESEARCH AND LEARNING,16,378,366,400,368
BEACH CHANNEL HIGH SCHOOL,78,378,384,396,354
EAGLE ACADEMY FOR YOUNG MEN,78,378,373,387,374
"HIGH SCHOOL FOR ARTS, IMAGINATION AND INQUIRY",49,378,374,384,374
BRONX HEALTH SCIENCES HIGH SCHOOL,74,378,370,381,382
FRANKLIN DELANO ROOSEVELT YABC,18,377,338,477,316
CYPRESS HILLS COLLEGIATE PREPARATORY SCHOOL,51,377,376,385,368
GLOBAL ENTERPRISE HIGH SCHOOL,57,377,372,382,375
BANANA KELLY HIGH SCHOOL,54,377,373,381,377
NEWCOMERS HIGH SCHOOL,143,376,323,475,329
HIGH SCHOOL FOR INTERNATIONAL BUSINESS AND FINANCE,76,376,365,384,378
PARK EAST HIGH SCHOOL,51,376,373,379,376
HIGH SCHOOL FOR CONTEMPORARY ARTS,55,376,383,378,365
"URBAN ASSEMBLY SCHOOL OF BUSINESS FOR YOUNG WOMEN, THE",42,376,373,370,384
LIFE ACADEMY HIGH SCHOOL FOR FILM AND MUSIC,40,375,384,375,365
CROTONA ACADEMY HIGH SCHOOL,9,375,379,364,382
ACADEMY FOR YOUNG WRITERS,68,375,387,357,381
HENRY STREET SCHOOL FOR INTERNATIONAL STUDIES,29,374,355,404,363
WASHINGTON IRVING HIGH SCHOOL,151,374,373,387,360
FREDERICK DOUGLASS ACADEMY III SECONDARY SCHOOL,50,374,368,384,369
EXPLORATIONS ACADEMY,57,374,381,381,360
FRANCES PERKINS ACADEMY,12,374,382,372,368
EDWARD A. REYNOLDS WEST SIDE HIGH SCHOOL,35,374,401,369,351
JONATHAN LEVIN HIGH SCHOOL FOR MEDIA AND COMMUNICATIONS,35,374,379,364,379
LOUIS D. BRANDEIS HIGH SCHOOL,131,373,370,390,358
FORDHAM LEADERSHIP ACADEMY FOR BUSINESS AND TECHNOLOGY,63,373,367,385,367
BROOKLYN THEATRE ARTS HIGH SCHOOL,54,373,383,358,377
PROGRESS HIGH SCHOOL FOR PROFESSIONAL CAREERS,144,372,364,379,371
DISCOVERY HIGH SCHOOL,55,372,372,379,364
WINGS ACADEMY,66,372,378,374,362
ACORN COMMUNITY HIGH SCHOOL,72,372,384,364,368
"BROOKLYN COMMUNITY HIGH SCHOOL OF COMMUNICATION, ARTS AND MEDIA",37,372,375,355,384
WILLIAMSBURG HIGH SCHOOL FOR ARCHITECTURE AND DESIGN,72,371,363,385,364
ACADEMY FOR CONSERVATION AND THE ENVIRONMENT,35,371,363,381,367
HIGH SCHOOL OF COMPUTERS AND TECHNOLOGY,72,371,381,376,354
HIGH SCHOOL OF HOSPITALITY MANAGEMENT,58,371,374,375,362
THE BRONXWOOD PREPARATORY ACADEMY,48,371,377,372,363
BRONX COMMUNITY HIGH SCHOOL,9,371,367,369,376
BROOKLYN SCHOOL FOR GLOBAL STUDIES,52,371,361,367,383
BAYARD RUSTIN EDUCATIONAL COMPLEX,59,371,378,365,368
JANE ADDAMS HIGH SCHOOL FOR ACADEMIC CAREERS,78,371,377,359,376
BROOKLYN LAB SCHOOL,57,370,360,385,363
NORMAN THOMAS HIGH SCHOOL,154,370,370,379,359
AUGUST MARTIN HIGH SCHOOL,101,370,377,371,360
WADLEIGH SECONDARY SCHOOL FOR THE PERFORMING & VISUAL ARTS,32,370,371,368,370
COMMUNITY HEALTH ACADEMY OF THE HEIGHTS,55,369,362,376,367
HIGH SCHOOL FOR SERVICE & LEARNING AT ERASMUS,61,369,362,375,368
HIGH SCHOOL FOR TEACHING AND THE PROFESSIONS,57,369,370,371,365
BRONX GUILD,39,369,369,371,365
WORLD ACADEMY FOR TOTAL COMMUNITY HEALTH HIGH SCHOOL,68,369,371,365,370
BRONX LEADERSHIP ACADEMY II HIGH SCHOOL,62,368,362,378,363
HIGH SCHOOL FOR LAW AND PUBLIC SERVICE,94,368,363,378,361
EAST BRONX ACADEMY FOR THE FUTURE,46,368,366,378,358
LYONS COMMUNITY SCHOOL,31,368,371,377,355
W. H. MAXWELL CAREER AND TECHNICAL EDUCATION HIGH SCHOOL,74,368,370,369,363
GRACE DODGE CAREER AND TECHNICAL EDUCATION HIGH SCHOOL,73,367,362,382,356
QUEENS PREPARATORY ACADEMY,52,367,360,380,359
ARTURO A. SCHOMBURG SATELLITE ACADEMY BRONX,14,367,380,372,349
"FELISA RINCON DE GAUTIER INSTITUTE FOR LAW AND PUBLIC POLICY, THE",68,367,373,370,356
PREPARATORY ACADEMY FOR WRITERS: A COLLEGE BOARD SCHOOL,43,367,370,367,363
METROPOLITAN CORPORATE ACADEMY HIGH SCHOOL,28,367,368,365,368
CHOIR ACADEMY OF HARLEM,20,367,354,360,385
HIGH SCHOOL FOR MEDIA AND COMMUNICATIONS,63,366,369,380,349
FREDERICK DOUGLASS ACADEMY II SECONDARY SCHOOL,43,366,356,379,361
MOTT HAVEN VILLAGE PREPARATORY HIGH SCHOOL,63,366,351,375,371
ACADEMY OF INNOVATIVE TECHNOLOGY,60,366,371,371,354
BOYS AND GIRLS HIGH SCHOOL,131,366,365,370,362
PHOENIX ACADEMY,9,366,367,370,360
ACADEMY FOR ENVIRONMENTAL LEADERSHIP,50,366,380,366,352
BROOKLYN BRIDGE ACADEMY,17,366,384,362,351
GEORGE WASHINGTON YABC,7,366,394,357,346
ACADEMY OF MEDICAL TECHNOLOGY: A COLLEGE BOARD SCHOOL,36,365,367,379,348
AUTOMOTIVE HIGH SCHOOL,94,365,367,376,350
FLUSHING YABC,9,365,378,373,344
GOTHAM PROFESSIONAL ARTS ACADEMY,36,365,370,372,351
INDEPENDENCE HIGH SCHOOL,14,365,389,371,335
ACADEMY OF ENVIRONMENTAL SCIENCE SECONDARY HIGH SCHOOL,48,365,369,369,357
HEALTH OPPORTUNITIES HIGH SCHOOL,114,365,363,368,364
SOUTH BRONX PREPARATORY: A COLLEGE BOARD SCHOOL,65,364,364,378,348
KURT HAHN EXPEDITIONARY LEARNING SCHOOL,43,364,368,378,346
BROOKLYN PREPARATORY HIGH SCHOOL,42,364,367,373,350
BROOKLYN HIGH SCHOOL FOR LAW AND TECHNOLOGY,46,364,362,372,358
FREDERICK DOUGLASS ACADEMY VII HIGH SCHOOL,55,364,361,371,359
MOTT HALL BRONX HIGH SCHOOL,67,364,369,367,356
W.E.B. DUBOIS ACADEMIC HIGH SCHOOL,7,364,394,364,334
"SCHOOL FOR HUMAN RIGHTS, THE",35,363,348,381,359
HOLCOMBE L. RUCKER SCHOOL OF COMMUNITY RESEARCH,39,362,363,371,350
JUAN MOREL CAMPOS SECONDARY SCHOOL,102,362,365,361,359
BREAD & ROSES INTEGRATED ARTS HIGH SCHOOL,61,362,369,361,355
COALITION SCHOOL FOR SOCIAL CHANGE,48,362,354,357,373
NEW EXPLORERS HIGH SCHOOL,28,362,367,356,361
"URBAN ASSEMBLY ACADEMY FOR HISTORY AND CITIZENSHIP FOR YOUNG MEN, THE",33,362,372,355,357
BRONX HIGH SCHOOL OF BUSINESS,34,361,356,376,351
BRONX HIGH SCHOOL FOR LAW AND COMMUNITY SERVICE,65,361,366,364,352
PAUL ROBESON HIGH SCHOOL,53,361,365,363,355
CHRISTOPHER COLUMBUS HIGH SCHOOL,121,361,367,361,353
LEADERSHIP INSTITUTE,30,361,361,353,367
EXPEDITIONARY LEARNING SCHOOL FOR COMMUNITY LEADERS,40,360,353,370,356
URBAN ASSEMBLY HIGH SCHOOL OF MUSIC AND ART,52,360,360,364,356
ARTS & MEDIA PREPARATORY ACADEMY,48,360,361,360,359
VALIDUS PREPARATORY ACADEMY: AN EXPEDITIONARY LEARNING SCHOOL,74,359,356,363,356
COMMUNITY SCHOOL FOR SOCIAL JUSTICE,43,359,361,359,357
URBAN ASSEMBLY SCHOOL FOR THE PERFORMING ARTS,56,359,360,353,364
FORDHAM HIGH SCHOOL FOR THE ARTS,48,359,355,350,372
SCHOOL FOR EXCELLENCE,32,358,363,360,351
PERFORMANCE CONSERVATORY HIGH SCHOOL,30,358,361,353,360
DR. SUSAN S. MCKINNEY SECONDARY SCHOOL OF THE ARTS,29,358,352,349,373
UNITY CENTER FOR URBAN TECHNOLOGIES,25,357,370,349,351
FREDERICK DOUGLASS ACADEMY IV SECONDARY SCHOOL,20,356,355,355,358
INTERNATIONAL HIGH SCHOOL AT LAGUARDIA COMMUNITY COLLEGE,69,355,326,409,329
JAMAICA HIGH SCHOOL,90,355,342,368,353
BRONX THEATRE HIGH SCHOOL,68,355,348,362,354
BROWNSVILLE ACADEMY HIGH SCHOOL,16,355,372,356,335
ACADEMY FOR SOCIAL ACTION: A COLLEGE BOARD SCHOOL,33,354,354,366,342
ACADEMY OF URBAN PLANNING,67,354,342,364,354
LEGACY SCHOOL FOR INTEGRATED STUDIES,29,354,356,357,349
MANHATTAN BRIDGES HIGH SCHOOL,66,353,336,378,344
"METROPOLITAN HIGH SCHOOL, THE",49,352,347,367,341
BUSHWICK LEADERS HIGH SCHOOL FOR ACADEMIC EXCELLENCE,23,352,347,358,350
"HERITAGE SCHOOL, THE",31,352,358,351,345
HIGH SCHOOL FOR CIVIL RIGHTS,47,352,363,349,342
JOHN F. KENNEDY HIGH SCHOOL,109,351,351,362,339
"FACING HISTORY SCHOOL, THE",76,351,353,358,340
FLUSHING INTERNATIONAL HIGH SCHOOL,45,350,314,417,318
NEW WORLD HIGH SCHOOL,72,350,332,381,335
BRONX EXPEDITIONARY LEARNING HIGH SCHOOL,39,350,324,376,349
NEW DAY ACADEMY,25,349,348,344,354
ACADEMY OF HOSPITALITY AND TOURISM,57,349,352,342,351
HIGH SCHOOL FOR VIOLIN AND DANCE,27,347,353,315,371
PABLO NERUDA ACADEMY FOR ARCHITECTURE AND WORLD STUDIES,67,346,337,361,340
MONROE ACADEMY FOR VISUAL ARTS & DESIGN,43,346,332,357,349
BUSHWICK SCHOOL FOR SOCIAL JUSTICE,75,345,348,353,334
EL PUENTE ACADEMY FOR PEACE AND JUSTICE,28,345,359,335,341
BUSHWICK COMMUNITY HIGH SCHOOL,24,345,359,317,358
SATELLITE ACADEMY HIGH SCHOOL,33,344,350,337,345
ENGLISH LANGUAGE LEARNERS AND INTERNATIONAL SUPPORT PREPARATORY ACADEMY (ELLIS),38,343,343,356,330
HIGH SCHOOL FOR YOUTH AND COMMUNITY DEVELOPMENT AT ERASMUS,73,343,338,349,340
FANNIE LOU HAMER FREEDOM HIGH SCHOOL,72,343,342,346,341
METROPOLITAN DIPLOMA PLUS HIGH SCHOOL,17,343,350,346,332
INTERNATIONAL HIGH SCHOOL AT LAFAYETTE,54,342,326,386,314
GRACE DODGE YABC,10,341,350,356,317
FDNY HIGH SCHOOL FOR FIRE AND LIFE SAFETY,37,341,341,349,333
BROOKLYN DEMOCRACY ACADEMY,11,340,349,338,331
GREGORIO LUPERON HIGH SCHOOL FOR SCIENCE AND MATHEMATICS,56,338,339,349,326
HARLEM RENAISSANCE HIGH SCHOOL,29,336,357,318,333
ASPIRATIONS DIPLOMA PLUS HIGH SCHOOL,7,331,311,371,311
PACIFIC HIGH SCHOOL,9,331,352,341,300
BROOKLYN INTERNATIONAL HIGH SCHOOL,90,327,305,364,312
PAN AMERICAN INTERNATIONAL HIGH SCHOOL AT MONROE,30,324,321,351,298
BRONX INTERNATIONAL HIGH SCHOOL,49,322,314,312,339
KINGSBRIDGE INTERNATIONAL HIGH SCHOOL,52,321,304,356,302
IT TAKES A VILLAGE ACADEMY,56,321,313,320,330
ACADEMY FOR LANGUAGE AND TECHNOLOGY,54,317,315,339,297
PAN AMERICAN INTERNATIONAL HIGH SCHOOL,55,317,317,323,311
INTERNATIONAL COMMUNITY HIGH SCHOOL,34,315,310,324,311
HIGH SCHOOL OF WORLD CULTURES,42,313,304,323,312
INTERNATIONAL SCHOOL FOR LIBERAL ARTS,49,312,300,333,301
INTERNATIONAL HIGH SCHOOL AT PROSPECT HEIGHTS,71,305,287,335,291
MULTICULTURAL HIGH SCHOOL,29,296,279,322,286
